{
  "$schema": "https://json-schema.org/draft/2020-12/schema",
  "$id": "https://github.com/ColeLeng/the-negotiator/schemas/job-spec.schema.json",
  "title": "JobSpec",
  "description": "The single structured contract that ties the three modules together. Built once by the Estimator (voice AND/OR documents), confirmed by the user, then reused VERBATIM by the Caller on every call and by the Closer during negotiation. A common envelope plus a vertical-specific `spec` whose fields are declared by the vertical config.",
  "type": "object",
  "required": ["jobId", "vertical", "source", "confirmedByUser", "buyer", "budget", "spec"],
  "additionalProperties": false,
  "properties": {
    "jobId": { "type": "string", "description": "Stable id reused across all calls for this job." },
    "vertical": { "type": "string", "description": "Vertical key; must match a file in config/verticals/.", "examples": ["wedding-dress", "moving"] },
    "createdAt": { "type": "string", "format": "date-time" },
    "source": {
      "type": "string",
      "enum": ["voice_interview", "document", "hybrid"],
      "description": "How the spec was produced. Both paths must yield this identical schema."
    },
    "confirmedByUser": {
      "type": "boolean",
      "description": "MUST be true before any call is made. The user confirms the spec verbatim."
    },
    "buyer": {
      "type": "object",
      "required": ["disclosureName"],
      "additionalProperties": false,
      "properties": {
        "name": { "type": "string" },
        "location": { "type": "string", "description": "City / region used to build the call list." },
        "phone": { "type": "string" },
        "email": { "type": "string", "format": "email" },
        "disclosureName": {
          "type": "string",
          "description": "How the agent names itself and who it acts for, e.g. 'an AI assistant calling on behalf of a customer'."
        }
      }
    },
    "budget": {
      "type": "object",
      "description": "The buyer's ZOPA — Zone Of Possible Agreement.",
      "required": ["currency", "target", "walkAway"],
      "additionalProperties": false,
      "properties": {
        "currency": { "type": "string", "default": "USD" },
        "target": { "type": "number", "description": "The price the buyer hopes to pay." },
        "walkAway": { "type": "number", "description": "The most the buyer will pay. Above this, decline." }
      }
    },
    "timeline": {
      "type": "object",
      "additionalProperties": false,
      "properties": {
        "neededBy": { "type": "string", "format": "date", "description": "Hard deadline (e.g. wedding date, move date)." },
        "flexible": { "type": "boolean", "default": false, "description": "Timing flexibility is itself a negotiation lever." }
      }
    },
    "spec": {
      "type": "object",
      "description": "Vertical-specific requirements. Field shape is declared by the vertical config's `specFields`. This is the description the Caller repeats identically on every call.",
      "additionalProperties": true
    },
    "alternatives": {
      "type": "array",
      "description": "Acceptable substitutions the buyer will consider (partial specs). Lets the Caller widen the net without misrepresenting the job.",
      "items": { "type": "object", "additionalProperties": true }
    },
    "constraints": {
      "type": "object",
      "additionalProperties": false,
      "properties": {
        "mustHave": { "type": "array", "items": { "type": "string" } },
        "niceToHave": { "type": "array", "items": { "type": "string" } },
        "dealBreaker": { "type": "array", "items": { "type": "string" } }
      }
    },
    "negotiation": {
      "type": "object",
      "additionalProperties": false,
      "properties": {
        "levers": {
          "type": "array",
          "description": "Allowed negotiation levers for this job (subset of the vertical config's negotiationLevers).",
          "items": { "type": "string" }
        },
        "redFlags": {
          "type": "object",
          "additionalProperties": false,
          "properties": {
            "belowMarketPct": {
              "type": "number",
              "default": 30,
              "description": "A quote this far below the vertical benchmark is a warning, not a win."
            }
          }
        }
      }
    }
  }
}
